[
  {
    "id": "maintenance-compensation",
    "name": "版本更新维护补偿",
    "category": "limited-time",
    "subcategory": "maintenance",
    "amount": {
      "value": 600,
      "unit": "primogems"
    },
    "rewards": {
      "primogems": 600,
      "intertwinedFates": 0,
      "acquaintFates": 0
    },
    "verification": {
      "status": "confirmed",
      "checkedAt": "2026-08-17"
    },
    "isOneTime": false,
    "estimatedMinutes": 0,
    "difficulty": "passive",
    "description": "7.0版本更新后邮件发放，登录领取即可",
    "guideLinks": []
  },
  {
    "id": "preview-livestream-codes",
    "name": "前瞻直播兑换码",
    "category": "limited-time",
    "subcategory": "live-stream",
    "amount": {
      "value": 300,
      "unit": "primogems"
    },
    "rewards": {
      "primogems": 300,
      "intertwinedFates": 0,
      "acquaintFates": 0
    },
    "verification": {
      "status": "confirmed",
      "checkedAt": "2026-08-17",
      "note": "前瞻兑换码已过有效期，不纳入 8 月 17 日起的新套餐可得资源。"
    },
    "isOneTime": true,
    "estimatedMinutes": 5,
    "difficulty": "easy",
    "description": "7.0前瞻直播的3个兑换码，限时兑换",
    "guideLinks": []
  },
  {
    "id": "daily-commission-phase1",
    "name": "每日委托（上半卡池期间）",
    "category": "recurring",
    "subcategory": "daily-commission",
    "amount": {
      "value": 900,
      "unit": "primogems",
      "note": "60原石/天 x 15天（按 2026-08-17 至 2026-09-01 17:59 计算）"
    },
    "rewards": {
      "primogems": 900,
      "intertwinedFates": 0,
      "acquaintFates": 0
    },
    "verification": {
      "status": "confirmed",
      "checkedAt": "2026-08-17"
    },
    "isOneTime": false,
    "estimatedMinutes": 225,
    "difficulty": "easy",
    "description": "每天4个委托+凯瑟琳对话，60原石/天。按剩余15天计算共900原石",
    "guideLinks": []
  },
  {
    "id": "stardust-exchange",
    "name": "星尘兑换（纠缠之缘）",
    "category": "recurring",
    "subcategory": "exchange",
    "amount": {
      "value": 800,
      "unit": "fates",
      "note": "5个纠缠之缘；不在数据中换算为原石"
    },
    "rewards": {
      "primogems": 0,
      "intertwinedFates": 5,
      "acquaintFates": 0
    },
    "verification": {
      "status": "confirmed",
      "checkedAt": "2026-08-17",
      "note": "需要玩家拥有足够星尘。"
    },
    "isOneTime": false,
    "estimatedMinutes": 1,
    "difficulty": "passive",
    "description": "每月星尘商店兑换5个纠缠之缘",
    "guideLinks": []
  },
  {
    "id": "starglitter-exchange",
    "name": "星辉兑换（纠缠之缘，无上限）",
    "category": "recurring",
    "subcategory": "exchange",
    "amount": {
      "value": 0,
      "unit": "fates",
      "note": "每 5 个无主的星辉兑换 1 个纠缠之缘，无兑换上限；实际数量取决于玩家星辉库存"
    },
    "rewards": {
      "primogems": 0,
      "intertwinedFates": 0,
      "acquaintFates": 0
    },
    "verification": {
      "status": "confirmed",
      "checkedAt": "2026-08-24",
      "note": "每 5 个无主的星辉兑换 1 个纠缠之缘，无兑换上限；不计入套餐固定收益。"
    },
    "isOneTime": false,
    "estimatedMinutes": 1,
    "difficulty": "passive",
    "description": "星辉商店可用 5 个无主的星辉兑换 1 个纠缠之缘，无兑换上限；需要玩家拥有星辉",
    "guideLinks": []
  },
  {
    "id": "archon-quest-7.0",
    "name": "魔神任务·第七章（至冬主线，已开放两幕）",
    "category": "one-time",
    "subcategory": "archon-quest",
    "amount": {
      "value": 60,
      "unit": "primogems",
      "note": "已开放两幕；每幕 30 原石，共 60 原石"
    },
    "rewards": {
      "primogems": 60,
      "intertwinedFates": 2,
      "acquaintFates": 0
    },
    "verification": {
      "status": "confirmed",
      "checkedAt": "2026-08-24",
      "note": "当前开放两幕；每幕完成奖励为 30 原石和 1 个纠缠之缘。任务内一次性秘境宝箱另计。"
    },
    "isOneTime": true,
    "estimatedMinutes": 270,
    "difficulty": "easy",
    "description": "已开放第七章第一幕与第二幕。每幕完成可得 30 原石和 1 个纠缠之缘；含剧情对话和战斗。",
    "prerequisite": "需完成第六章魔神任务",
    "guideLinks": []
  },
  {
    "id": "domain-first-clears-snezhnaya",
    "name": "至冬新秘境首通",
    "category": "one-time",
    "subcategory": "exploration",
    "amount": {
      "value": 0,
      "unit": "primogems",
      "note": "常驻/新场景秘境首通没有原石奖励；按用户确认口径记录。"
    },
    "rewards": {
      "primogems": 0,
      "intertwinedFates": 0,
      "acquaintFates": 0
    },
    "verification": {
      "status": "confirmed",
      "checkedAt": "2026-08-27",
      "note": "用户已确认：常驻秘境首通无原石奖励，解锁/首次通关不计入原石资源。"
    },
    "isOneTime": true,
    "estimatedMinutes": 20,
    "difficulty": "medium",
    "description": "首通常驻秘境/新场景秘境不计原石；保留作为地图功能解锁任务，不进入原石推荐。",
    "guideLinks": []
  },
  {
    "id": "offerings-snezhnaya",
    "name": "徽印供奉·聚所共建（3个聚所）",
    "category": "one-time",
    "subcategory": "other",
    "amount": {
      "value": 750,
      "unit": "primogems",
      "note": "每个聚所共建每级 50 原石，当前上限 5 级；三个聚所满级共 750 原石"
    },
    "rewards": {
      "primogems": 750,
      "intertwinedFates": 0,
      "acquaintFates": 0,
      "other": [
        "巡猎者木屋、汐歌洞窟、科洛列夫茨基剧院",
        "聚所纪事世界任务前置"
      ]
    },
    "verification": {
      "status": "confirmed",
      "checkedAt": "2026-08-24",
      "note": "三个聚所各有独立的聚所共建供奉。每级 50 原石、当前上限 5 级，单个满级 250 原石；共建进度取决于玩家已获得的徽印。"
    },
    "isOneTime": true,
    "estimatedMinutes": 30,
    "difficulty": "medium",
    "description": "向巡猎者木屋、汐歌洞窟和科洛列夫茨基剧院的聚所共建供奉徽印。聚所纪事属于世界任务，完成后可解锁对应供奉前置。"
  },
  {
    "id": "world-quest-snezhnaya",
    "name": "至冬世界任务",
    "category": "one-time",
    "subcategory": "world-quest",
    "amount": {
      "value": 870,
      "unit": "primogems",
      "note": "21 条世界任务汇总；三个聚所纪事均属于世界任务且不直接奖励原石"
    },
    "rewards": {
      "primogems": 870,
      "intertwinedFates": 0,
      "acquaintFates": 0
    },
    "verification": {
      "status": "confirmed",
      "checkedAt": "2026-08-24",
      "note": "已按资源库 21 条世界任务的直接原石汇总。三个聚所纪事归入本项，均不直接奖励原石；聚所共建供奉奖励另列。"
    },
    "isOneTime": true,
    "estimatedMinutes": 479,
    "difficulty": "medium",
    "description": "至冬 7.0 的 21 条世界任务，包含巡猎者木屋、汐歌洞窟和科洛列夫茨基剧院的聚所纪事。部分有隐藏前置需探索触发。",
    "guideLinks": []
  },
  {
    "id": "exploration-snezhnaya-chests",
    "name": "至冬宝箱探索",
    "category": "one-time",
    "subcategory": "exploration",
    "amount": {
      "value": 2500,
      "unit": "primogems",
      "note": "预估，含普通/精致/珍贵/华丽宝箱"
    },
    "rewards": {
      "primogems": 2500,
      "intertwinedFates": 0,
      "acquaintFates": 0
    },
    "verification": {
      "status": "estimated",
      "checkedAt": "2026-08-17",
      "note": "需按区域宝箱批次与供奉奖励拆分后校验。"
    },
    "isOneTime": true,
    "estimatedMinutes": 480,
    "difficulty": "medium",
    "description": "至冬新区域全宝箱收集，含月球/月之高地/月之八/挪德卡莱等区域",
    "guideLinks": [
      {
        "platform": "bilibili",
        "url": "https://www.bilibili.com/video/BV1JG8H6zEN3",
        "title": "【原神宝箱全收集】至冬7.0",
        "creator": "你的影月月",
        "creatorId": "ying-yueyue",
        "publisherVerification": {
          "status": "confirmed",
          "creatorId": "ying-yueyue",
          "checkedAt": "2026-08-20",
          "sourceUrl": "https://space.bilibili.com/431073645/upload/video"
        }
      },
      {
        "platform": "bilibili",
        "url": "https://www.bilibili.com/video/BV1BMgj6MEz4",
        "title": "【原神一条龙全收集】至冬7.0",
        "creator": "你的影月月",
        "creatorId": "ying-yueyue",
        "publisherVerification": {
          "status": "confirmed",
          "creatorId": "ying-yueyue",
          "checkedAt": "2026-08-20",
          "sourceUrl": "https://space.bilibili.com/431073645/upload/video"
        }
      }
    ]
  },
  {
    "id": "exploration-cryo-oculi",
    "name": "冰神瞳收集",
    "category": "one-time",
    "subcategory": "exploration",
    "amount": {
      "value": 600,
      "unit": "primogems",
      "note": "140 个冰神瞳可将冰神像升至 6 级；每升 1 级 100 原石"
    },
    "rewards": {
      "primogems": 600,
      "intertwinedFates": 0,
      "acquaintFates": 0
    },
    "verification": {
      "status": "confirmed",
      "checkedAt": "2026-08-24",
      "note": "140 个冰神瞳可将冰神像升至 6 级，每级 100 原石，共 600 原石。"
    },
    "isOneTime": true,
    "estimatedMinutes": 120,
    "difficulty": "medium",
    "description": "收集 140 个冰神瞳并供奉至冰神像 6 级。每升一级获得 100 原石，共 600 原石。",
    "guideLinks": [
      {
        "platform": "bilibili",
        "url": "https://www.bilibili.com/video/BV131b26FE1u",
        "title": "【原神至冬冰神瞳】140已完结·分区域收集",
        "creator": "你的影月月",
        "creatorId": "ying-yueyue",
        "publisherVerification": {
          "status": "confirmed",
          "creatorId": "ying-yueyue",
          "checkedAt": "2026-08-20",
          "sourceUrl": "https://space.bilibili.com/431073645/upload/video"
        }
      }
    ]
  },
  {
    "id": "achievements-7.0",
    "name": "7.0版本新增成就",
    "category": "one-time",
    "subcategory": "achievement",
    "amount": {
      "value": 625,
      "unit": "primogems",
      "note": "米游社 7.0 成就攻略汇总为 85 项、共 625 原石"
    },
    "rewards": {
      "primogems": 625,
      "intertwinedFates": 0,
      "acquaintFates": 0
    },
    "verification": {
      "status": "confirmed",
      "checkedAt": "2026-08-21"
    },
    "isOneTime": true,
    "estimatedMinutes": 120,
    "difficulty": "medium",
    "description": "至冬 7.0 新增成就共 85 项，攻略汇总为 625 原石。执行与核验均使用已录入的一次性资源目录攻略。",
    "guideLinks": [
      {
        "platform": "miyoushe",
        "url": "https://www.miyoushe.com/ys/article/77367908",
        "title": "【V7.0】原神7.0新增成就收集攻略（共计85个）"
      },
      {
        "platform": "miyoushe",
        "url": "https://www.miyoushe.com/ys/article/77351014",
        "title": "【V7.0】版本新增成就"
      }
    ]
  },
  {
    "id": "spiral-abyss-first-clear",
    "name": "深境螺旋永久首通（第1-8层）",
    "category": "one-time",
    "subcategory": "spiral-abyss",
    "amount": {
      "value": 2400,
      "unit": "primogems",
      "note": "每层按 3 / 6 / 9 星各领取 100 原石；8 层全部满星共 2400 原石"
    },
    "rewards": {
      "primogems": 2400,
      "intertwinedFates": 0,
      "acquaintFates": 0
    },
    "verification": {
      "status": "confirmed",
      "checkedAt": "2026-08-24",
      "note": "第 1-8 层每层 3 / 6 / 9 星各 100 原石；仅包含尚未领取的永久首次奖励，不与第 9-12 层轮换奖励重复计算。"
    },
    "isOneTime": true,
    "estimatedMinutes": 60,
    "difficulty": "hard",